"Game Naam","Game Genre","Game Prijs","Gameplay Score","Graphics Score","Story Score","Toelichting"
"Space Invaders","Shooter","10.989","5","5","5","Het leukste spel ooit!"
"Super Mario Bros","Adventure","21.989","5","5","3","Ik vind dat het spel heel fijn speelt maar de story is wat kort."
"The Legend of Zelda","Adventure","29.99","4","3","5","Heel tevreden over dit spel"
"Pac-Man","Arcade","8.991","1","3","2","Storyline is goed maar gameplay is slecht."
"Tetris","Puzzle","13.491","3","2","1","Spel was heel matig."
"Tetris","Puzzle","13.491","4","3","4","goede game"
